{"$schema":"https://json-schema.org/draft/2020-12/schema","$id":"https://agent-reliability-protocol.dev/schemas/gate-decision-2.0.0.json","type":"object","required":["decision","checkpoint","reasons","evidence","threshold_version"],"properties":{"decision":{"enum":["approve","warn","request_clarification","block"]},"risk_score":{"type":["number","null"],"minimum":0,"maximum":1},"confidence":{"type":["number","null"],"minimum":0,"maximum":1},"checkpoint":{"type":"string","minLength":1},"reasons":{"type":"array","items":{"type":"object","required":["code","message","evidence"]}},"evidence":{"type":"array","items":{"$ref":"evidence-reference.schema.json"}},"threshold_version":{"type":"string","minLength":1}},"additionalProperties":false}
